{
  "case_id": "OSINT-008",
  "investigation_goal": "Reconstruct the Wirecard public-fraud trail by linking company statements, audit uncertainty, missing cash, supervisory failures, and Jan Marsalek disappearance.",
  "target": "Wirecard / Jan Marsalek public fraud trail",
  "investigation_category": "Shell Company & Corporate Fraud",
  "difficulty": "Hard",
  "sources": [
    {
      "source_id": "SRC-001",
      "type": "Web_Page",
      "uri": "https://wirecard.com/wp-content/uploads/2021/01/AH_2020_04_28_KPMG-report.pdf",
      "content": {
        "page_title": "Wirecard AG: KPMG delivers report on special investigation",
        "publication_date": "2020-04-28",
        "date_accessed": "2026-06-29",
        "verification_status": "Opened successfully with the web tool; relevant content was present.",
        "evidence_summary": "Wirecard announced receipt of the KPMG special audit report and said no incriminating evidence of balance-sheet forgery had been identified, while acknowledging not all data needed to prove historical third-party acquiring revenues could be obtained.",
        "supports_findings": [
          "FIND-001",
          "FIND-003"
        ],
        "confidence": "High",
        "fetch_date": "2026-08-18",
        "fetch_status": 200,
        "fetch_content_type": "application/pdf",
        "retrieved_sha256": "374ee61de3b9c477a4559d01688d7a9dd92192478093b5313c55c9948ee196dd",
        "snapshot_status": "refreshed_from_fetch"
      },
      "raw_text": "04/28/2020 \nWirecard AG: KPMG delivers report on special investigation \nWirecard AG / Key word(s): Miscellaneous \nWirecard AG: KPMG delivers report on special investigation \n \n28-Apr-2020 / 07:52 CET/CEST \nDisclosure of an inside information acc. to Article 17 MAR of the Regulation (EU) No 596/2014, \ntransmitted by DGAP - a service of EQS Group AG. \nThe issuer is solely responsible for the content of this announcement. \nWirecard AG in the early hours of today, April 28 2020, received the special audit report by the \nauditing company KPMG. The report will be published as soon as possible under \nhttps://www.wirecard.com/transparency. \nIncriminating evidence for the public allegations of balance sheet forgery has not been identified. With \nrespect to all four areas of the audit - Third Party Acquiring business (TPA), Merchant Cash Advance \n(MCA)/Digital Lending as well as the business activities in India and Singapore -  no significant \nfindings have been made, which would require an adjustment of the annual accounts 2016-2018. \nIn the course of the audits of the annual accounts for the years 2016-2018 the available documents \nand audit measures were sufficient for the proof of the revenues in the Third Party Acquiring business. \nAccording to the increased forensic requirements of the audit by KPMG, however, not all data could be \nobtained that would have been required  to proof the revenues in these years, because the required \ndata are primarily in the control of third parties. Since Wirecard meanwhile controls the necessary data \nitself, more than 200 mio data relating to December 2019 sets have been provided to KPMG for a \nforensic audit. This audit has not revealed any deviations between the reported revenues and account \nbalances.  \nKPMG has identified documentation and organizational weaknesses during the audit period, which \nhad already been identified by Wirecard. Wirecard remedies these weaknesses since 2019 by \nestablishing a Global Compliance Organization and with the support of external consultants.   \nThe release of the annual accounts and the annual press conference will not take place on 30 April \n2020. Wirecard will coordinate as soon as possible with the auditor E&Y, when the audit measures \ncan be completed taking into account the Corona related restrictions and the completion of the KPMG \nreport. \n \nContact: \nIris Stöckl \nVP Corp.Com./IR \nTel.: +49 (0)89-4424-1424 \ne-Mail: iris.stoeckl@wirecard.com \nhttp://www.wirecard.com \nISIN DE0007472060 \nReuters: WDI.GDE \nBloomberg: WDI GY  \n28-Apr-2020 CET/CEST The DGAP Distribution Services include Regulatory Announcements, \nFinancial/Corporate News and Press Releases.  \nArchive at www.dgap.de \nLanguage: English \nCompany: Wirecard AG  Einsteinring 35  85609 Aschheim b. München  Germany \nPhone: +49 (0)89-4424 1400 \nFax: +49 (0)89-4424 1500 \nE-mail: ir@wirecard.com \nInternet: www.wirecard.com \nISIN: DE0007472060 \nWKN: 747206 \nIndices: DAX, TecDAX, Prime All Share, Technology All Share \nListed: Regulated Market in Frankfurt (Prime Standard); Regulated Unofficial Market in Berlin, \nDusseldorf, Hamburg, Munich, Stuttgart, Tradegate Exchange \nEQS News ID: 1031139 \n \n \n  \nEnd of AnnouncementDGAP News Service\n "
    },
    {
      "source_id": "SRC-002",
      "type": "Web_Page",
      "uri": "https://safe-frankfurt.de/fileadmin/user_upload/editor_common/Policy_Center/SAFE_Policy_White_Paper_74.pdf",
      "content": {
        "page_title": "What are the wider supervisory implications of the Wirecard case?",
        "publication_date": "2021",
        "date_accessed": "2026-08-18",
        "verification_status": "Direct PDF fetch and text extraction succeeded.",
        "evidence_summary": "The SAFE paper examines the Wirecard scandal, the KPMG special investigation, supervisory failures, and the implications of the company's collapse.",
        "supports_findings": [
          "FIND-001",
          "FIND-002",
          "FIND-003"
        ],
        "confidence": "High",
        "fetch_date": "2026-08-18",
        "fetch_status": 200,
        "fetch_content_type": "application/pdf",
        "snapshot_status": "refreshed_from_fetch",
        "source_quality": "SAFE policy white paper",
        "retrieved_sha256": "8decb7bf6b8e4437c0520b435931bff0dbd03b5129517301ca3f8d6c9f2b53af"
      },